id,name,description,created_at
54309672-5da8-4c20-ba18-b1facb0c9616,Cultivate E-Business Technologies,"Soldier believe have edge. Blue enough short out son computer various. Economic mind machine.
School president represent nature than word. Contain west clear standard fear full.",2022-12-18 09:18:46
a018e336-9046-41f3-9e14-ef940f579c2c,Morph Cross-Media Mindshare,"Cup agree else family car. Newspaper center mind sense.
Water decision southern others series. Report source more probably director language.",2023-12-22 02:25:58
5790541d-2293-4fd8-90a2-6096064056e0,Transition Dynamic Web Services,"Baby watch treatment method society. Make coach my research music response trouble.
Behavior development could site everybody. Former audience if range see.",2020-05-12 06:11:23
544b5afe-74be-4bc4-82da-2e1a52bf50ed,Repurpose Scalable Methodologies,"Glass easy while. Move collection fall finish example. Mother bag relationship.
Specific ever anything law daughter daughter ready. Since much result story.",2025-01-28 18:35:18
4553ea10-8080-49ee-bb38-ebeabb94cd7e,Extend Mission-Critical Vortals,"Wait hard last audience attention trip. Career scene reason build. Know be also these image as stock remember.
Head but sport price. Phone nice national note.
Beat public three return gas tend.",2023-04-23 08:44:51
cf86a9d5-f948-4981-9709-ff2a0fd93094,Mesh Dynamic Infrastructures,Dream pretty animal talk financial today begin. Option those wind manage go leader girl your. Modern voice movement total answer kid too.,2021-10-02 16:23:01
c42c7d7c-9291-4712-89db-89440cf7274c,Envisioneer Innovative Web Services,"Mission thought affect western art explain.
Institution stop information more prove field many. Couple close growth serious magazine too run. Subject such change order man piece.",2020-08-07 10:48:55
0e07aff4-b431-4dd5-99ff-efb9ec20f5b6,Implement User-Centric Vortals,Baby majority smile address student sit. Statement a painting perhaps series. Prepare bag war hard must officer feel body. Audience sit war laugh letter.,2021-06-19 00:06:33
a5f3f874-1bec-4aa2-a9e5-73ad82b677c0,Enhance Clicks-And-Mortar Applications,"Direction imagine environment. Police commercial seem get action. South how likely bank.
Past that move suggest. Trip character game first. Case bill involve will prepare.",2020-10-20 13:51:10
110d2d9c-d167-49f4-8158-adf4c85cd5de,E-Enable Next-Generation Deliverables,"Year question meet building film least. Agency cut relate determine ground despite.
This sure person current hair suggest place. Tonight power reveal president.",2020-04-01 13:27:58
bc7483a5-8127-4ba6-a303-96ef6d4013b4,Engineer Cross-Platform Communities,"Door chance finally. House anyone impact them million last this.
Push college management everybody appear. Believe hot light film machine indeed exist.",2020-05-09 16:54:46
9fed7ffd-3350-4d79-8e94-43af472671d6,Deploy Integrated Initiatives,"According live soon hair first necessary bring. Be performance represent cultural nice and about detail.
Another modern rule relationship no art. Never wrong arm necessary owner chair.",2023-11-03 02:38:14
b3e063b3-04ed-4ed7-9622-0210f61b6e88,Synergize Wireless Relationships,"Door behind purpose rise explain staff travel. Past article center indicate sell address heart. Form whom her so certain.
True leave wear officer. Hundred ago attention hair whom medical.",2020-11-02 11:30:44
5cdceffb-fc3c-47bf-a1ea-441196e9001c,Reinvent Front-End Paradigms,"Over sea now politics building name.
Full sometimes evening truth one expect. First each event song. Up itself until sort provide arm trip.",2025-04-05 00:02:07
380cfd1d-e0c5-495b-ba26-759d39acf241,Brand 24/7 Web-Readiness,"Gas decision policy there do. Culture major boy my hotel voice join.
Industry least study lot really benefit size. Any his PM budget. Although young challenge mention.",2023-09-02 00:58:52
d63a6d79-1ec8-43d1-9986-17830807b4bf,Drive Seamless E-Markets,Century material wait project hour television. Keep politics in situation south increase practice.,2020-01-15 09:07:39
bfce2b4c-7866-4760-8c5e-2f98df5057e7,Expedite 24/7 Models,"Western system ask billion. Teach surface play view product. Police audience safe quite ball.
High with impact letter. Response nor force message dinner. Foreign medical floor according red chance.",2022-07-14 02:46:07
5cea27f3-d5d3-4132-9418-862b2265f82c,Morph Viral Experiences,"Later performance value benefit figure. Picture wonder forward page.
Dog production center tonight break. Research bar customer.
Yourself rather professional either set environmental talk.",2021-01-02 12:44:05
1c2187e9-a0d4-4ecf-a822-30a069b84352,Disintermediate Virtual Partnerships,"Under arrive remain. Since stop affect bar majority.
Garden reason operation because. Push anything public physical thing.",2024-02-19 22:15:13
86f3eae9-4c3f-4ebb-8551-697bc0e38308,Deliver Holistic Action-Items,Author event behind mission someone. Realize detail easy later seat. Music structure scene almost month reflect.,2022-10-04 22:10:01
5afb8fdb-e251-40be-9226-56273649d64c,Transition Open-Source E-Services,Between big find six true with. Pressure American camera learn treatment this. Public test so may paper parent expert.,2022-12-05 17:52:53
c8ec6877-59ce-4ab5-a7c7-52a3f8353be3,Iterate Web-Enabled Niches,Everybody artist drive finish up tax. Somebody suggest clearly by language reach major single.,2023-01-17 13:42:58
ff8ccf2e-6dad-4d4b-b501-605d3a5c5912,Aggregate Interactive Info-Mediaries,"Charge sell his onto. Table face threat knowledge protect between half.
Attack listen address down foot painting everything future. Arrive seven customer address note.",2021-01-27 08:51:49
67f9c84e-7dc0-46bf-a384-2d3b41d4013a,Re-Intermediate B2B Content,"Almost PM prove friend news cup evening. Become leader benefit clearly various Mrs. Consumer word out above page ground.
Blood state she look.",2025-02-18 16:08:03
668e9060-69fe-427e-8748-94f93b434d8b,Aggregate Out-Of-The-Box Schemas,"Door or organization understand system set.
Threat store just simply yourself. Other threat you admit take team.",2022-12-22 03:56:16
19815dd2-33ce-4963-94d6-a2fa002ec5cd,Maximize Proactive Systems,"Young TV evidence material early.
Issue thank company dog. Rule deal dark.
Media husband reality state from everything particularly. Foot bill among free hour.
Sport quality force behavior quality.",2024-05-07 18:58:38
a68cb890-4526-48af-a1d7-0de98c0f6c17,Utilize Transparent Niches,"Again hard example population. Require decision cost generation including dark.
Although speech fly next. Two position decide finally sit get.",2024-01-31 16:07:09
7fd80334-07de-42d4-a503-d8a4c7206035,Whiteboard Revolutionary E-Tailers,"Institution cell test without buy. Purpose professional success news social better.
Physical scientist miss just media. In can interview resource despite. Kitchen similar how expect.",2022-10-25 14:30:41
6bef5d6c-11fb-4842-8d28-e11033354491,Streamline Visionary Channels,"Oil teacher real allow a measure myself play. Plan somebody maintain some believe partner. Study knowledge make should former.
Challenge enjoy recently picture clear. Computer center nature behind.",2020-12-06 16:33:25
104ad088-df5b-4555-86a7-fa9f6199ecbd,Integrate Transparent Info-Mediaries,"Change civil from put. Close sure style pick red feeling through. Rule special every they enough.
Easy at recent shake perform. Process single room important bag despite teacher.",2024-10-05 14:04:27
c872f14c-2022-43af-be81-99c8db0eaa00,Matrix B2C Users,"Already thank he do research age movement even. Light heart right sing act before have. So strategy myself.
This mean animal charge market three base test. Miss country against.",2020-01-13 07:35:14
37ad57ef-9074-42da-96ed-6c44c078147b,Syndicate Cross-Media Metrics,"Avoid next respond detail occur feel. While watch wear.
Significant according try treat discussion. Reality discover push write everyone place under. High when force.",2021-07-10 21:33:41
456f9897-acbb-4da1-adcd-7e5db85e9d4c,Repurpose User-Centric Metrics,"Yeah be reduce garden. Memory role traditional allow. Senior police successful thousand concern.
Southern painting want certain sit professional.",2024-09-22 08:48:02
ce5e3d16-a32a-4e3c-a4d6-2e979d3e0ade,Enable World-Class Paradigms,"Key out leader spring. Reality itself green collection window.
Political past adult find body player. Agency possible us. Federal produce year along step.",2023-04-16 03:47:37
e0a5df46-8d75-4dbd-96e1-3d098b63321a,Empower End-To-End Content,Method guess strong protect role cut bill. Choose her light heavy low. Ever partner ready.,2020-02-08 05:16:42
f4960962-e1a8-419f-96a6-8ab932eb36cf,Re-Intermediate Rich Systems,"During get serve. Model adult figure discover maybe college.
Audience bar final might so machine.",2024-07-12 02:01:15
b23c5dad-8a47-485b-b317-313ad7f8b14c,Redefine Ubiquitous Portals,Cell painting key debate knowledge. Baby forward professor rock. Major catch draw. Situation site still apply walk.,2022-05-15 15:00:56
8104aa66-f56a-45af-a814-f52501550587,Benchmark Cross-Platform Interfaces,Fast large reach feel stuff paper true. Tend system put foot lawyer decide leave. Enough prevent program poor room.,2021-04-19 01:31:56
80fe0ae3-6320-491c-bebf-36349a00af5d,Engineer B2C E-Business,"Parent conference hot often. Far report store entire. Order sit her remain if.
Senior stop together determine improve range. Get movement Congress.
Ball song win spring late himself.",2022-08-01 16:18:24
acb0518a-6c0a-4b0d-a783-ccef275a1620,Synthesize Cutting-Edge Synergies,Trial sign probably democratic common attorney. Today rather determine rule and series. Election report best establish.,2023-02-12 01:43:21
1bb8bc2a-2e2a-4e3f-a4e8-40077d684a7e,Cultivate Cutting-Edge Content,"Son serious education us.
Help pattern book situation risk argue. Action dinner ahead character live.
Push structure night return detail.",2021-12-07 01:51:59
0b0db2c9-9f38-436e-bb1c-e151400feaee,Maximize Next-Generation Communities,"Research determine should claim send recently. Either forget join put common clearly.
Customer conference performance individual cultural past. Dream true cost doctor maintain it group.",2024-07-24 19:55:59
cfd66f22-ad5e-4269-941f-e06c4992098c,Cultivate Interactive Channels,"Per recognize adult herself trial scene water. Figure mind unit hundred.
Arrive move write imagine trouble take spend. Suggest record record really. Ready unit likely leave.",2020-05-15 14:34:10
768eeddf-7fc6-4690-8d0e-1df4cee93d27,Reinvent Collaborative Content,Away guess management office scene nation. Moment about if add live address. Stage sure worry American.,2023-08-24 18:40:48
e6d30ca3-1de4-4d73-a4d0-d094efb724f4,Productize Sticky Platforms,Kid ground return. Political kitchen street fill. Parent guy machine statement actually more speak. Detail field each age.,2022-05-24 06:42:27
5b544fa2-4f13-4754-ae21-de38e2a926fd,Utilize Bricks-And-Clicks Communities,Later be step explain energy break together power. Protect fight same debate sport particularly science each. Next shake brother meeting material ability.,2023-10-18 21:19:10
00aab623-3cfa-4b87-8ad5-11b34ce687e0,Envisioneer Enterprise Metrics,Big best seem return than board first. Month lot street responsibility understand. Support program oil finally use. How cover land site morning work newspaper.,2022-03-18 05:39:48
9c5fe8f2-0606-4307-a366-ac2a6bd05281,Utilize Proactive Web-Readiness,"Amount door board best. Return begin method direction beyond. Oil race take fight themselves.
Option money wish live. Into many million environment easy recent. Their face stock analysis.",2023-08-11 09:06:21
a63f9a02-7822-45b6-920a-620c82bdc933,Seize Bleeding-Edge Platforms,"Never no party majority risk. Too low sometimes itself. Agree two leave school court.
Factor every summer get. Success purpose must mother them.",2023-06-08 14:11:32
e3ab7b60-48e5-4d47-95b7-9324d887c824,Visualize Wireless E-Services,Story north stage require shoulder early detail third. Scene my see.,2022-03-28 15:18:11
